{
  "$schema": "https://json-schema.org/draft/2020-12/schema",
  "$id": "https://meta.audiosilo.app/schema/recording.schema.json",
  "title": "recording",
  "description": "A specific narration/production of a work: narrators, abridged flag, runtime, chapters, publisher(s), and region-scoped identifiers. One production released in several marketplaces stays ONE recording: the region rides on the identifier (asin[], the object form of isbn[]) and on publishers[], never on a second record.",
  "type": "object",
  "additionalProperties": false,
  "required": ["id", "work", "narrators", "language", "license", "sources"],
  "dependentRequired": {
    "publishers": ["publisher"]
  },
  "properties": {
    "id": {
      "$ref": "common.schema.json#/$defs/slug"
    },
    "work": {
      "$ref": "common.schema.json#/$defs/slug"
    },
    "narrators": {
      "description": "The recording's narrators as person slugs. The slug is the identity, so the list may not repeat one.",
      "type": "array",
      "minItems": 1,
      "uniqueItems": true,
      "items": {
        "$ref": "common.schema.json#/$defs/slug"
      }
    },
    "abridged": {
      "description": "Whether this narration is abridged. Optional: absence means unknown, so importers omit it rather than guessing.",
      "type": "boolean"
    },
    "language": {
      "$ref": "common.schema.json#/$defs/language"
    },
    "runtime_min": {
      "type": "integer",
      "exclusiveMinimum": 0
    },
    "release_date": {
      "$ref": "common.schema.json#/$defs/date_flex"
    },
    "publisher": {
      "description": "The publisher of record for this production. One production can be issued by a different imprint in another marketplace; those go in publishers[], and this field stays the one the record leads with.",
      "type": "string",
      "minLength": 1
    },
    "publishers": {
      "description": "OTHER regions' imprints of this same production, one entry per region. It never restates the top-level publisher (that fact already has a home) and never repeats a region. Emitted only when a source STATED a regional publisher - absence means nothing is known about that marketplace, not that the publisher of record covers it. It REQUIRES publisher (see dependentRequired): \"the other regions\" is meaningless without the one it is other than, and a record carrying publishers[] with no publisher is a trap - the next enrichment run fills the absent field from a row, which can be a name already in this list, minting the restatement pkg/check refuses. The dependency turns that into a schema error at compose time rather than a validation failure after the write.",
      "type": "array",
      "minItems": 1,
      "items": {
        "type": "object",
        "additionalProperties": false,
        "required": ["region", "publisher"],
        "properties": {
          "region": {
            "$ref": "common.schema.json#/$defs/region"
          },
          "publisher": {
            "type": "string",
            "minLength": 1
          }
        }
      }
    },
    "asin": {
      "type": "array",
      "minItems": 1,
      "items": {
        "type": "object",
        "additionalProperties": false,
        "required": ["region", "asin"],
        "properties": {
          "region": {
            "$ref": "common.schema.json#/$defs/region"
          },
          "asin": {
            "$ref": "common.schema.json#/$defs/asin"
          }
        }
      }
    },
    "isbn": {
      "description": "This recording's ISBNs. An entry has exactly one of two forms, and they mix freely in one list: a bare STRING is an ISBN whose region is unstated, and the OBJECT {isbn, region} is used ONLY when the region IS known - one production released in several marketplaces carries different identifiers, and this is how the second one is recorded without minting a second recording. Both properties are required in the object form, so an unstated region has exactly one spelling and canonical form stays unambiguous. The bare string is not merely the shape that predates regions: it is the SCALE form. No bulk writer emits anything else (no import source states the marketplace an ISBN belongs to, and the issue forms contribute a scoped entry one at a time), and across 142k recordings one canonical line beats the object's four against the pack size caps - which is what enrichment filling ISBNs in bulk will spend. The region-scoped form earns its four lines by stating a fact nothing else can.",
      "type": "array",
      "minItems": 1,
      "items": {
        "oneOf": [
          {
            "$ref": "common.schema.json#/$defs/isbn"
          },
          {
            "type": "object",
            "additionalProperties": false,
            "required": ["region", "isbn"],
            "properties": {
              "region": {
                "$ref": "common.schema.json#/$defs/region"
              },
              "isbn": {
                "$ref": "common.schema.json#/$defs/isbn"
              }
            }
          }
        ]
      }
    },
    "cover_url": {
      "type": "string",
      "format": "uri",
      "pattern": "^https://"
    },
    "chapters": {
      "type": "array",
      "minItems": 1,
      "items": {
        "type": "object",
        "additionalProperties": false,
        "required": ["title", "start_ms", "length_ms"],
        "properties": {
          "title": {
            "type": "string",
            "minLength": 1
          },
          "start_ms": {
            "type": "integer",
            "minimum": 0
          },
          "length_ms": {
            "type": "integer",
            "exclusiveMinimum": 0
          },
          "audio_url": {
            "description": "The audio file this chapter IS, for a recording published as one file per section (LibriVox: the archive.org MP3). Only a LibriVox recording carries it today, so pkg/check requires librivox_id beside it.",
            "$ref": "common.schema.json#/$defs/https_url"
          }
        }
      }
    },
    "librivox_id": {
      "description": "The LibriVox project id this recording IS. The identity a LibriVox import deduplicates on (never the title); unique across the dataset (pkg/check).",
      "$ref": "common.schema.json#/$defs/librivox_id"
    },
    "archive_id": {
      "description": "The Internet Archive item identifier holding this recording's files (archive.org/details/<archive_id>).",
      "type": "string",
      "pattern": "^[A-Za-z0-9][A-Za-z0-9._-]*$"
    },
    "links": {
      "description": "Where the recording is published, as the source stated each URL: its catalogue page (librivox), a zip of every file (zip) and its podcast feed (rss). https only.",
      "type": "object",
      "additionalProperties": false,
      "minProperties": 1,
      "properties": {
        "librivox": {
          "$ref": "common.schema.json#/$defs/https_url"
        },
        "zip": {
          "$ref": "common.schema.json#/$defs/https_url"
        },
        "rss": {
          "$ref": "common.schema.json#/$defs/https_url"
        }
      }
    },
    "added_at": {
      "description": "When this recording entered the database. Stamped at creation by the importer and the intake bot as a plain date; records dated by the one-time git-history backfill carry that commit's full timestamp verbatim. Optional, since records predating the field carry none.",
      "$ref": "common.schema.json#/$defs/date_or_datetime"
    },
    "license": {
      "$ref": "common.schema.json#/$defs/license"
    },
    "sources": {
      "$ref": "common.schema.json#/$defs/sources"
    }
  }
}
