{
  "abridged": false,
  "asin": [
    {
      "asin": "B0CGG8VQ6K",
      "region": "us"
    }
  ],
  "cover_url": "https://m.media-amazon.com/images/I/81SD4jadUVL.jpg",
  "id": "jill-dopp-2023",
  "language": "en",
  "license": "CC0-1.0",
  "narrators": [
    "jill-dopp",
    "john-sadoway",
    "adam-mclaughlin"
  ],
  "publisher": "MTMorrow LTD",
  "release_date": "2023",
  "runtime_min": 94,
  "sources": [
    {
      "imported_at": "2026-07-25",
      "ref": "B0CGG8VQ6K",
      "type": "audiosilo-books-import"
    }
  ],
  "work": "the-croxley-master"
}
