{
  "abridged": false,
  "asin": [
    {
      "asin": "1713548178",
      "region": "us"
    }
  ],
  "cover_url": "https://m.media-amazon.com/images/I/91uAay1WmWL.jpg",
  "id": "stina-nielsen-2021",
  "language": "en",
  "license": "CC0-1.0",
  "narrators": [
    "stina-nielsen"
  ],
  "publisher": "Brilliance Audio",
  "release_date": "2021-04-20",
  "runtime_min": 1522,
  "sources": [
    {
      "imported_at": "2026-07-30",
      "ref": "1713548178",
      "type": "libex-import"
    }
  ],
  "work": "the-crown-of-gilded-bones"
}
