{
  "abridged": false,
  "asin": [
    {
      "asin": "1645419592",
      "region": "us"
    }
  ],
  "chapters": [
    {
      "length_ms": 4345869,
      "start_ms": 0,
      "title": "Chapter 1"
    },
    {
      "length_ms": 3717328,
      "start_ms": 4345869,
      "title": "Chapter 2"
    },
    {
      "length_ms": 4215907,
      "start_ms": 8063197,
      "title": "Chapter 3"
    },
    {
      "length_ms": 3684821,
      "start_ms": 12279104,
      "title": "Chapter 4"
    },
    {
      "length_ms": 3838165,
      "start_ms": 15963925,
      "title": "Chapter 5"
    },
    {
      "length_ms": 4163104,
      "start_ms": 19802090,
      "title": "Chapter 6"
    }
  ],
  "cover_url": "https://m.media-amazon.com/images/I/9194zWxz2cL.jpg",
  "id": "full-cast-2020",
  "language": "en",
  "license": "CC0-1.0",
  "narrators": [
    "full-cast"
  ],
  "publisher": "GraphicAudio",
  "release_date": "2020",
  "runtime_min": 389,
  "sources": [
    {
      "imported_at": "2026-07-25",
      "ref": "1645419592",
      "type": "audiosilo-books-import"
    },
    {
      "imported_at": "2026-07-30",
      "ref": "1645419592",
      "type": "libex-import"
    }
  ],
  "work": "cold-asylum-dramatized-adaptation"
}
