{
  "abridged": false,
  "asin": [
    {
      "asin": "B0DVZNR98C",
      "region": "us"
    },
    {
      "asin": "B003A8JK6Y",
      "region": "us"
    }
  ],
  "cover_url": "https://m.media-amazon.com/images/I/91H+vrAxK1L.jpg",
  "id": "kimberly-alexis-2025",
  "language": "en",
  "license": "CC0-1.0",
  "narrators": [
    "kimberly-alexis"
  ],
  "publisher": "Bolinda audio",
  "release_date": "2025-04-01",
  "runtime_min": 1170,
  "sources": [
    {
      "imported_at": "2026-07-30",
      "ref": "B0DVZNR98C",
      "type": "libex-import"
    },
    {
      "imported_at": "2026-07-30",
      "ref": "B003A8JK6Y",
      "type": "libex-import"
    }
  ],
  "work": "obsidian-butterfly"
}
