{
  "abridged": false,
  "asin": [
    {
      "asin": "B0DQF47V3W",
      "region": "us"
    }
  ],
  "chapters": [
    {
      "length_ms": 34924,
      "start_ms": 0,
      "title": "Opening Credits"
    },
    {
      "length_ms": 4019976,
      "start_ms": 34924,
      "title": "Track 1"
    },
    {
      "length_ms": 3842182,
      "start_ms": 4054900,
      "title": "Track 2"
    },
    {
      "length_ms": 3868305,
      "start_ms": 7897082,
      "title": "Track 3"
    },
    {
      "length_ms": 3961347,
      "start_ms": 11765387,
      "title": "Track 4"
    },
    {
      "length_ms": 69088,
      "start_ms": 15726734,
      "title": "Track 5"
    },
    {
      "length_ms": 4097592,
      "start_ms": 15795822,
      "title": "End Credits"
    }
  ],
  "cover_url": "https://m.media-amazon.com/images/I/81gH112-RsL.jpg",
  "id": "full-cast-2025",
  "language": "en",
  "license": "CC0-1.0",
  "narrators": [
    "full-cast"
  ],
  "publisher": "GraphicAudio",
  "release_date": "2025",
  "runtime_min": 331,
  "sources": [
    {
      "imported_at": "2026-07-25",
      "ref": "B0DQF47V3W",
      "type": "audiosilo-books-import"
    },
    {
      "imported_at": "2026-07-30",
      "ref": "B0DQF47V3W",
      "type": "libex-import"
    }
  ],
  "work": "renegades-dramatized-adaptation-the-midnight-project-book-1"
}
