{
  "abridged": false,
  "asin": [
    {
      "asin": "B097G9CG2C",
      "region": "us"
    },
    {
      "asin": "B097G4GYT5",
      "region": "ca"
    },
    {
      "asin": "B097GG118T",
      "region": "uk"
    },
    {
      "asin": "B097GGHTN1",
      "region": "au"
    },
    {
      "asin": "B097GD5BKS",
      "region": "de"
    }
  ],
  "cover_url": "https://m.media-amazon.com/images/I/81CiU1yrItS.jpg",
  "id": "jake-urry-2021",
  "language": "en",
  "license": "CC0-1.0",
  "narrators": [
    "jake-urry"
  ],
  "publisher": "Jake Urry",
  "release_date": "2021-06-18",
  "runtime_min": 189,
  "sources": [
    {
      "imported_at": "2026-07-30",
      "ref": "B097G9CG2C",
      "type": "libex-import"
    },
    {
      "imported_at": "2026-07-30",
      "ref": "B097G4GYT5",
      "type": "libex-import"
    },
    {
      "imported_at": "2026-07-30",
      "ref": "B097GG118T",
      "type": "libex-import"
    },
    {
      "imported_at": "2026-07-30",
      "ref": "B097GGHTN1",
      "type": "libex-import"
    },
    {
      "imported_at": "2026-07-30",
      "ref": "B097GD5BKS",
      "type": "libex-import"
    }
  ],
  "work": "the-strange-case-of-dr-jekyll-and-mr-hyde"
}
