{
  "abridged": false,
  "asin": [
    {
      "asin": "B004X2AJDY",
      "region": "us"
    }
  ],
  "chapters": [
    {
      "length_ms": 625081,
      "start_ms": 0,
      "title": "Chapter 1"
    },
    {
      "length_ms": 620019,
      "start_ms": 625081,
      "title": "Chapter 2"
    },
    {
      "length_ms": 910965,
      "start_ms": 1245100,
      "title": "Chapter 3"
    },
    {
      "length_ms": 546505,
      "start_ms": 2156065,
      "title": "Chapter 4"
    },
    {
      "length_ms": 660840,
      "start_ms": 2702570,
      "title": "Chapter 5"
    },
    {
      "length_ms": 936879,
      "start_ms": 3363410,
      "title": "Chapter 6"
    },
    {
      "length_ms": 1446975,
      "start_ms": 4300289,
      "title": "Chapter 7"
    },
    {
      "length_ms": 496071,
      "start_ms": 5747264,
      "title": "Chapter 8"
    },
    {
      "length_ms": 419352,
      "start_ms": 6243335,
      "title": "Chapter 9"
    },
    {
      "length_ms": 621505,
      "start_ms": 6662687,
      "title": "Chapter 10"
    },
    {
      "length_ms": 717543,
      "start_ms": 7284192,
      "title": "Chapter 11"
    },
    {
      "length_ms": 1031941,
      "start_ms": 8001735,
      "title": "Chapter 12"
    },
    {
      "length_ms": 747218,
      "start_ms": 9033676,
      "title": "Chapter 13"
    },
    {
      "length_ms": 960702,
      "start_ms": 9780894,
      "title": "Chapter 14"
    },
    {
      "length_ms": 970966,
      "start_ms": 10741596,
      "title": "Chapter 15"
    },
    {
      "length_ms": 1074062,
      "start_ms": 11712562,
      "title": "Chapter 16"
    },
    {
      "length_ms": 870145,
      "start_ms": 12786624,
      "title": "Chapter 17"
    },
    {
      "length_ms": 832760,
      "start_ms": 13656769,
      "title": "Chapter 18"
    },
    {
      "length_ms": 765330,
      "start_ms": 14489529,
      "title": "Chapter 19"
    },
    {
      "length_ms": 504477,
      "start_ms": 15254859,
      "title": "Chapter 20"
    },
    {
      "length_ms": 1245147,
      "start_ms": 15759336,
      "title": "Chapter 21"
    },
    {
      "length_ms": 400823,
      "start_ms": 17004483,
      "title": "Chapter 22"
    },
    {
      "length_ms": 1006957,
      "start_ms": 17405306,
      "title": "Chapter 23"
    },
    {
      "length_ms": 735562,
      "start_ms": 18412263,
      "title": "Chapter 24"
    },
    {
      "length_ms": 467418,
      "start_ms": 19147825,
      "title": "Chapter 25"
    },
    {
      "length_ms": 615422,
      "start_ms": 19615243,
      "title": "Chapter 26"
    },
    {
      "length_ms": 974216,
      "start_ms": 20230665,
      "title": "Chapter 27"
    },
    {
      "length_ms": 567681,
      "start_ms": 21204881,
      "title": "Chapter 28"
    },
    {
      "length_ms": 703983,
      "start_ms": 21772562,
      "title": "Chapter 29"
    },
    {
      "length_ms": 645468,
      "start_ms": 22476545,
      "title": "Chapter 30"
    },
    {
      "length_ms": 685546,
      "start_ms": 23122013,
      "title": "Chapter 31"
    },
    {
      "length_ms": 389956,
      "start_ms": 23807559,
      "title": "Chapter 32"
    },
    {
      "length_ms": 331860,
      "start_ms": 24197515,
      "title": "Chapter 33"
    },
    {
      "length_ms": 328841,
      "start_ms": 24529375,
      "title": "Chapter 34"
    },
    {
      "length_ms": 438718,
      "start_ms": 24858216,
      "title": "Chapter 35"
    },
    {
      "length_ms": 865083,
      "start_ms": 25296934,
      "title": "Chapter 36"
    },
    {
      "length_ms": 1139125,
      "start_ms": 26162017,
      "title": "Chapter 37"
    },
    {
      "length_ms": 465142,
      "start_ms": 27301142,
      "title": "Chapter 38"
    },
    {
      "length_ms": 679648,
      "start_ms": 27766284,
      "title": "Chapter 39"
    },
    {
      "length_ms": 502526,
      "start_ms": 28445932,
      "title": "Chapter 40"
    },
    {
      "length_ms": 1012622,
      "start_ms": 28948458,
      "title": "Chapter 41"
    },
    {
      "length_ms": 737094,
      "start_ms": 29961080,
      "title": "Chapter 42"
    },
    {
      "length_ms": 522077,
      "start_ms": 30698174,
      "title": "Chapter 43"
    },
    {
      "length_ms": 677094,
      "start_ms": 31220251,
      "title": "Chapter 44"
    },
    {
      "length_ms": 432030,
      "start_ms": 31897345,
      "title": "Chapter 45"
    },
    {
      "length_ms": 1116369,
      "start_ms": 32329375,
      "title": "Chapter 46"
    },
    {
      "length_ms": 515715,
      "start_ms": 33445744,
      "title": "Chapter 47"
    },
    {
      "length_ms": 720747,
      "start_ms": 33961459,
      "title": "Chapter 48"
    },
    {
      "length_ms": 762358,
      "start_ms": 34682206,
      "title": "Chapter 49"
    },
    {
      "length_ms": 589415,
      "start_ms": 35444564,
      "title": "Chapter 50"
    },
    {
      "length_ms": 683595,
      "start_ms": 36033979,
      "title": "Chapter 51"
    },
    {
      "length_ms": 737048,
      "start_ms": 36717574,
      "title": "Chapter 52"
    },
    {
      "length_ms": 640267,
      "start_ms": 37454622,
      "title": "Chapter 53"
    },
    {
      "length_ms": 1031709,
      "start_ms": 38094889,
      "title": "Chapter 54"
    },
    {
      "length_ms": 515762,
      "start_ms": 39126598,
      "title": "Chapter 55"
    },
    {
      "length_ms": 540932,
      "start_ms": 39642360,
      "title": "Chapter 56"
    },
    {
      "length_ms": 655499,
      "start_ms": 40183292,
      "title": "Chapter 57"
    },
    {
      "length_ms": 636923,
      "start_ms": 40838791,
      "title": "Chapter 58"
    }
  ],
  "cover_url": "https://m.media-amazon.com/images/I/81yaKoiLaqL.jpg",
  "id": "tom-stechschulte-2011",
  "language": "en",
  "license": "CC0-1.0",
  "narrators": [
    "tom-stechschulte"
  ],
  "publisher": "Recorded Books",
  "release_date": "2011",
  "runtime_min": 693,
  "sources": [
    {
      "imported_at": "2026-07-25",
      "ref": "B004X2AJDY",
      "type": "audiosilo-books-import"
    },
    {
      "imported_at": "2026-07-30",
      "ref": "B004X2AJDY",
      "type": "libex-import"
    }
  ],
  "work": "the-widowers-two-step"
}
