{
  "abridged": false,
  "asin": [
    {
      "asin": "B002V8N8TE",
      "region": "us"
    }
  ],
  "chapters": [
    {
      "length_ms": 2560092,
      "start_ms": 0,
      "title": "Chapter 1"
    }
  ],
  "cover_url": "https://m.media-amazon.com/images/I/81YeI+N8j+L.jpg",
  "id": "mary-pope-osborne-2007",
  "language": "en",
  "license": "CC0-1.0",
  "narrators": [
    "mary-pope-osborne"
  ],
  "publisher": "Listening Library",
  "release_date": "2007",
  "runtime_min": 42,
  "sources": [
    {
      "imported_at": "2026-07-25",
      "ref": "B002V8N8TE",
      "type": "audiosilo-books-import"
    },
    {
      "imported_at": "2026-07-30",
      "ref": "B002V8N8TE",
      "type": "libex-import"
    }
  ],
  "work": "thanksgiving-on-thursday"
}
