{
  "abridged": false,
  "asin": [
    {
      "asin": "B002VACVG8",
      "region": "us"
    }
  ],
  "cover_url": "https://m.media-amazon.com/images/I/912gMTElccL.jpg",
  "id": "nadia-may-2007",
  "language": "en",
  "license": "CC0-1.0",
  "narrators": [
    "nadia-may"
  ],
  "publisher": "Blackstone Audio, Inc.",
  "release_date": "2007",
  "runtime_min": 355,
  "sources": [
    {
      "imported_at": "2026-07-25",
      "ref": "B002VACVG8",
      "type": "audiosilo-books-import"
    }
  ],
  "work": "captains-courageous"
}
