{
  "abridged": false,
  "asin": [
    {
      "asin": "B083KP7RSK",
      "region": "us"
    }
  ],
  "cover_url": "https://m.media-amazon.com/images/I/91R4eEgETlL.jpg",
  "id": "eric-chantelauze-2020",
  "language": "fr",
  "license": "CC0-1.0",
  "narrators": [
    "eric-chantelauze"
  ],
  "publisher": "Audible Studios",
  "release_date": "2020-01-16",
  "runtime_min": 1279,
  "sources": [
    {
      "imported_at": "2026-07-30",
      "ref": "B083KP7RSK",
      "type": "libex-import"
    }
  ],
  "work": "xenocide"
}
