{
  "abridged": false,
  "asin": [
    {
      "asin": "B0DNGH8BZX",
      "region": "us"
    }
  ],
  "chapters": [
    {
      "length_ms": 33924,
      "start_ms": 0,
      "title": "Opening Credits"
    },
    {
      "length_ms": 3902276,
      "start_ms": 33924,
      "title": "Part 1"
    },
    {
      "length_ms": 3999590,
      "start_ms": 3936200,
      "title": "Part 2"
    },
    {
      "length_ms": 3942005,
      "start_ms": 7935790,
      "title": "Part 3"
    },
    {
      "length_ms": 3684124,
      "start_ms": 11877795,
      "title": "Part 4"
    },
    {
      "length_ms": 4079606,
      "start_ms": 15561919,
      "title": "Part 5"
    },
    {
      "length_ms": 3906966,
      "start_ms": 19641525,
      "title": "Part 6"
    },
    {
      "length_ms": 4560000,
      "start_ms": 23548491,
      "title": "Part 7"
    },
    {
      "length_ms": 78556,
      "start_ms": 28108491,
      "title": "End Credits"
    }
  ],
  "cover_url": "https://m.media-amazon.com/images/I/91paL5LLDTL.jpg",
  "id": "full-cast-2025",
  "language": "en",
  "license": "CC0-1.0",
  "narrators": [
    "full-cast"
  ],
  "publisher": "Graphic Audio LLC",
  "release_date": "2025",
  "runtime_min": 470,
  "sources": [
    {
      "imported_at": "2026-07-25",
      "ref": "B0DNGH8BZX",
      "type": "audiosilo-books-import"
    },
    {
      "imported_at": "2026-07-30",
      "ref": "B0DNGH8BZX",
      "type": "libex-import"
    }
  ],
  "work": "sin-and-lightning-dramatized-adaptation"
}
