{
  "abridged": false,
  "asin": [
    {
      "asin": "B002V5BKFG",
      "region": "us"
    }
  ],
  "id": "charles-kuralt-2026",
  "language": "en",
  "license": "CC0-1.0",
  "narrators": [
    "charles-kuralt"
  ],
  "publisher": "Penguin Audiobooks",
  "release_date": "2026-02-11",
  "sources": [
    {
      "imported_at": "2026-07-30",
      "ref": "B002V5BKFG",
      "type": "libex-import"
    }
  ],
  "work": "when-we-were-very-young"
}
