{
  "abridged": false,
  "asin": [
    {
      "asin": "B07BFGVM9V",
      "region": "us"
    }
  ],
  "cover_url": "https://m.media-amazon.com/images/I/81OABV47vjL.jpg",
  "id": "christopher-ragland-2018",
  "language": "en",
  "license": "CC0-1.0",
  "narrators": [
    "christopher-ragland"
  ],
  "publisher": "Random House Audiobooks",
  "release_date": "2018",
  "runtime_min": 445,
  "sources": [
    {
      "imported_at": "2026-07-25",
      "ref": "B07BFGVM9V",
      "type": "audiosilo-books-import"
    }
  ],
  "work": "texas-ranger"
}
