{
  "abridged": false,
  "asin": [
    {
      "asin": "B00TPK6474",
      "region": "us"
    }
  ],
  "cover_url": "https://m.media-amazon.com/images/I/91IGaDE5aAL.jpg",
  "id": "burghart-klau-ner-2013",
  "language": "de",
  "license": "CC0-1.0",
  "narrators": [
    "burghart-klau-ner",
    "matthias-brandt",
    "wolfram-koch"
  ],
  "publisher": "Der Hörverlag",
  "release_date": "2013-06-19",
  "runtime_min": 2290,
  "sources": [
    {
      "imported_at": "2026-07-30",
      "ref": "B00TPK6474",
      "type": "libex-import"
    }
  ],
  "work": "ulysses"
}
