{
  "abridged": false,
  "asin": [
    {
      "asin": "B0DZ34DYDF",
      "region": "us"
    }
  ],
  "cover_url": "https://m.media-amazon.com/images/I/91Jj0cvKNTL.jpg",
  "id": "susan-edni-2025",
  "language": "en",
  "license": "CC0-1.0",
  "narrators": [
    "susan-edni"
  ],
  "publisher": "Anthony Pica Productions, LLC",
  "release_date": "2025-03-04",
  "runtime_min": 207,
  "sources": [
    {
      "imported_at": "2026-07-30",
      "ref": "B0DZ34DYDF",
      "type": "libex-import"
    }
  ],
  "work": "through-the-looking-glass"
}
