{
  "abridged": false,
  "asin": [
    {
      "asin": "B0CYHQFLMC",
      "region": "us"
    }
  ],
  "cover_url": "https://m.media-amazon.com/images/I/91WsMVNeapL.jpg",
  "id": "amanda-friday-2024",
  "language": "en",
  "license": "CC0-1.0",
  "narrators": [
    "amanda-friday",
    "anna-grace",
    "erin-grassie",
    "josh-innerst",
    "rosie-otoole",
    "sara-sheckells",
    "tim-sailer"
  ],
  "publisher": "Spoken Realms",
  "release_date": "2024-03-20",
  "runtime_min": 327,
  "sources": [
    {
      "imported_at": "2026-07-30",
      "ref": "B0CYHQFLMC",
      "type": "libex-import"
    }
  ],
  "work": "tik-tok-of-oz"
}
