{
  "abridged": false,
  "asin": [
    {
      "asin": "B0FKQDQCB5",
      "region": "us"
    }
  ],
  "cover_url": "https://m.media-amazon.com/images/I/9175LxUJtmL.jpg",
  "id": "petr-filin-2025",
  "language": "ru",
  "license": "CC0-1.0",
  "narrators": [
    "petr-filin"
  ],
  "publisher": "AB Publishing",
  "release_date": "2025-08-14",
  "runtime_min": 877,
  "sources": [
    {
      "imported_at": "2026-07-30",
      "ref": "B0FKQDQCB5",
      "type": "libex-import"
    }
  ],
  "work": "paradise-lost"
}
