{
  "abridged": false,
  "asin": [
    {
      "asin": "B0DGML6WYQ",
      "region": "us"
    }
  ],
  "chapters": [
    {
      "length_ms": 34924,
      "start_ms": 0,
      "title": "Opening Credits"
    },
    {
      "length_ms": 2359633,
      "start_ms": 34924,
      "title": "The Gambler"
    },
    {
      "length_ms": 2373683,
      "start_ms": 2394557,
      "title": "Long in the Tooth"
    },
    {
      "length_ms": 2609365,
      "start_ms": 4768240,
      "title": "I'm Not Gonna Miss You"
    },
    {
      "length_ms": 2449983,
      "start_ms": 7377605,
      "title": "Another You"
    },
    {
      "length_ms": 2357196,
      "start_ms": 9827588,
      "title": "Leaving on a Jet Plane"
    },
    {
      "length_ms": 1977000,
      "start_ms": 12184784,
      "title": "Biscuits"
    },
    {
      "length_ms": 234000,
      "start_ms": 14161784,
      "title": "Closing Credits"
    },
    {
      "length_ms": 46443,
      "start_ms": 14395784,
      "title": "Dedication"
    }
  ],
  "cover_url": "https://m.media-amazon.com/images/I/919K-hiKPGL.jpg",
  "id": "melanie-scrofano-2024",
  "language": "en",
  "license": "CC0-1.0",
  "narrators": [
    "melanie-scrofano",
    "tim-rozon",
    "dom-provost-chalkley",
    "kat-barrell",
    "varun-saranga",
    "dani-kind",
    "martina-ortiz-luis",
    "greg-lawson",
    "full-cast"
  ],
  "publisher": "Audible Originals",
  "release_date": "2024",
  "runtime_min": 241,
  "sources": [
    {
      "imported_at": "2026-07-25",
      "ref": "B0DGML6WYQ",
      "type": "audiosilo-books-import"
    },
    {
      "imported_at": "2026-07-30",
      "ref": "B0DGML6WYQ",
      "type": "libex-import"
    }
  ],
  "work": "wynonna-earp"
}
