{
  "abridged": false,
  "asin": [
    {
      "asin": "B06WRSGW6H",
      "region": "us"
    }
  ],
  "cover_url": "https://m.media-amazon.com/images/I/91HujQm9-ML.jpg",
  "id": "thomas-judd-2017",
  "language": "en",
  "license": "CC0-1.0",
  "narrators": [
    "thomas-judd"
  ],
  "publisher": "Simon & Schuster Audio UK",
  "release_date": "2017-02-23",
  "runtime_min": 681,
  "sources": [
    {
      "imported_at": "2026-07-30",
      "ref": "B06WRSGW6H",
      "type": "libex-import"
    }
  ],
  "work": "the-executioner"
}
