{
  "abridged": false,
  "asin": [
    {
      "asin": "B06XJDXNGN",
      "region": "us"
    },
    {
      "asin": "B06XJDHNFH",
      "region": "de"
    }
  ],
  "cover_url": "https://m.media-amazon.com/images/I/91t-UXk5V5L.jpg",
  "id": "george-guidall-2017",
  "language": "en",
  "license": "CC0-1.0",
  "narrators": [
    "george-guidall"
  ],
  "publisher": "William Morrow",
  "release_date": "2017-03-28",
  "runtime_min": 1252,
  "sources": [
    {
      "imported_at": "2026-07-30",
      "ref": "B06XJDXNGN",
      "type": "libex-import"
    },
    {
      "imported_at": "2026-07-30",
      "ref": "B06XJDHNFH",
      "type": "libex-import"
    }
  ],
  "work": "american-gods"
}
