{
  "abridged": false,
  "asin": [
    {
      "asin": "B00WVG9CDC",
      "region": "us"
    }
  ],
  "cover_url": "https://m.media-amazon.com/images/I/91AzX3-5rCL.jpg",
  "id": "laural-merlington-2015",
  "language": "en",
  "license": "CC0-1.0",
  "narrators": [
    "laural-merlington"
  ],
  "publisher": "Brilliance Audio",
  "release_date": "2015-06-30",
  "runtime_min": 491,
  "sources": [
    {
      "imported_at": "2026-07-30",
      "ref": "B00WVG9CDC",
      "type": "libex-import"
    }
  ],
  "work": "in-plain-sight-fern-michaels"
}
