{
  "abridged": false,
  "asin": [
    {
      "asin": "B08512J57Z",
      "region": "us"
    }
  ],
  "cover_url": "https://m.media-amazon.com/images/I/81TvFjg9tdL.jpg",
  "id": "matthew-j-chandler-smith-2020",
  "language": "en",
  "license": "CC0-1.0",
  "narrators": [
    "matthew-j-chandler-smith"
  ],
  "publisher": "Hourly History Limited",
  "release_date": "2020-02-21",
  "runtime_min": 59,
  "sources": [
    {
      "imported_at": "2026-07-30",
      "ref": "B08512J57Z",
      "type": "libex-import"
    }
  ],
  "work": "robert-e-lee-a-life-from-beginning-to-end"
}
