{
  "abridged": false,
  "asin": [
    {
      "asin": "B0CTMXFTFS",
      "region": "us"
    }
  ],
  "cover_url": "https://m.media-amazon.com/images/I/91XyoYkiXiL.jpg",
  "id": "amy-adair-2024",
  "language": "en",
  "license": "CC0-1.0",
  "narrators": [
    "amy-adair"
  ],
  "publisher": "Lone Ghost Publishing",
  "release_date": "2024-02-02",
  "runtime_min": 600,
  "sources": [
    {
      "imported_at": "2026-07-30",
      "ref": "B0CTMXFTFS",
      "type": "libex-import"
    }
  ],
  "work": "fire-burn-cauldron-bubble"
}
