{
  "abridged": false,
  "asin": [
    {
      "asin": "B00HWF0MHW",
      "region": "us"
    }
  ],
  "cover_url": "https://m.media-amazon.com/images/I/91f2FBJPbKL.jpg",
  "id": "michael-kramer-2014",
  "language": "en",
  "license": "CC0-1.0",
  "narrators": [
    "michael-kramer",
    "kate-reading"
  ],
  "publisher": "Macmillan Audio",
  "release_date": "2014",
  "runtime_min": 2893,
  "sources": [
    {
      "imported_at": "2026-07-25",
      "ref": "B00HWF0MHW",
      "type": "audiosilo-books-import"
    }
  ],
  "work": "words-of-radiance"
}
